{
  "$id": "https://schemas.example.com/shop/order-placed.json",
  "type": "object",
  "additionalProperties": false,
  "properties": {
    "items": {
      "type": "integer",
      "description": "How many items the order has.",
      "x-audit-class": "shared",
      "x-audit-pii": "none"
    },
    "channel": {
      "type": "string",
      "enum": ["web", "app"],
      "x-audit-class": "shared",
      "x-audit-pii": "none",
      "x-audit-facet": true
    }
  }
}
