{
  "$id": "https://schemas.example/access-roster/v1/sign-in.json",
  "type": "object",
  "additionalProperties": false,
  "properties": {
    "how": {
      "type": "string",
      "description": "How the person proved who they are: the sign-in connector, or recovery.",
      "x-audit-class": "shared",
      "x-audit-pii": "none",
      "x-audit-facet": true
    },
    "class": {
      "type": "string",
      "enum": [
        "interactive",
        "agent"
      ],
      "description": "The class of the session the sign-in opens: interactive for a person at a browser, agent for software that keeps its own refresh token and works in the background. Absent on a refusal and on a sign-in to the console.",
      "x-audit-class": "shared",
      "x-audit-pii": "none",
      "x-audit-facet": true
    },
    "deadline": {
      "type": "string",
      "description": "The latest the session the sign-in opens may live, however often it is refreshed: auth_time plus its class's absolute limit, shortened by its resource's.",
      "x-audit-class": "shared",
      "x-audit-pii": "none",
      "format": "date-time"
    },
    "reason_code": {
      "type": "string",
      "description": "Why a refusal was given, as a code: unknown_audience, not_admitted, subject_token_refused, directory_unavailable and the like. Only on a refusal.",
      "x-audit-class": "shared",
      "x-audit-pii": "none",
      "x-audit-facet": true
    },
    "audience": {
      "type": "string",
      "description": "The client or audience the caller asked for. Only on a refusal.",
      "x-audit-class": "shared",
      "x-audit-pii": "none",
      "x-audit-facet": true
    },
    "missing_requires": {
      "type": "array",
      "description": "The groups the audience requires, any of which would have admitted the caller, that the caller does not hold. Only on a refusal.",
      "x-audit-class": "shared",
      "x-audit-pii": "none",
      "items": {
        "type": "string",
        "x-audit-class": "shared",
        "x-audit-pii": "none"
      }
    },
    "held_groups": {
      "type": "array",
      "description": "The groups the policy evaluation gave the caller. Only on a refusal.",
      "x-audit-class": "shared",
      "x-audit-pii": "none",
      "items": {
        "type": "string",
        "x-audit-class": "shared",
        "x-audit-pii": "none"
      }
    },
    "admitted": {
      "type": "boolean",
      "description": "Whether the evaluation admitted the caller to the audience. Only on a refusal.",
      "x-audit-class": "shared",
      "x-audit-pii": "none"
    },
    "admitted_by": {
      "type": "array",
      "description": "The required groups that admitted the caller, when one did. Only on a refusal.",
      "x-audit-class": "shared",
      "x-audit-pii": "none",
      "items": {
        "type": "string",
        "x-audit-class": "shared",
        "x-audit-pii": "none"
      }
    },
    "directory": {
      "type": "string",
      "description": "The state of what the groups were read from: live, held (the last answer, while the directory is unreachable), unavailable, or not_applicable. Only on a refusal.",
      "x-audit-class": "shared",
      "x-audit-pii": "none",
      "x-audit-facet": true
    }
  }
}
