{
  "$id": "https://schemas.example/access-roster/v1/backup-run.json",
  "type": "object",
  "additionalProperties": false,
  "properties": {
    "installation": {
      "type": "string",
      "description": "The installation the backup is of, as its path in the archive bucket names it.",
      "x-audit-class": "shared",
      "x-audit-pii": "none"
    },
    "trigger": {
      "type": "string",
      "description": "What started the run: schedule, run (a person or workload asked) or cli.",
      "x-audit-class": "shared",
      "x-audit-pii": "none"
    },
    "modules": {
      "type": "integer",
      "description": "How many modules the backup holds.",
      "x-audit-class": "shared",
      "x-audit-pii": "none"
    },
    "records": {
      "type": "integer",
      "description": "How many records the backup holds, in all sections.",
      "x-audit-class": "shared",
      "x-audit-pii": "none"
    },
    "chunks": {
      "type": "integer",
      "description": "How many sealed chunks the backup holds.",
      "x-audit-class": "shared",
      "x-audit-pii": "none"
    },
    "resumed": {
      "type": "boolean",
      "description": "Whether the run continued one that had been interrupted.",
      "x-audit-class": "shared",
      "x-audit-pii": "none"
    },
    "object_key": {
      "type": "string",
      "description": "The key of the encrypted object in the archive bucket, as the sidecar names it. Absent on a failure.",
      "x-audit-class": "shared",
      "x-audit-pii": "none"
    },
    "object_size": {
      "type": "integer",
      "description": "The size in bytes of the encrypted object. Absent on a failure.",
      "x-audit-class": "shared",
      "x-audit-pii": "none"
    },
    "object_sha256": {
      "type": "string",
      "description": "The SHA-256 of the encrypted object, lower-case hex. A restore requires the object it fetched to match it. Absent on a failure.",
      "x-audit-class": "shared",
      "x-audit-pii": "none"
    },
    "sidecar_sha256": {
      "type": "string",
      "description": "The SHA-256 of the sidecar as it was written, lower-case hex. A restore requires the sidecar it fetched to match it. Absent on a failure.",
      "x-audit-class": "shared",
      "x-audit-pii": "none"
    },
    "recipients": {
      "type": "array",
      "description": "The SHA-256 of each age recipient (the age1... string) the backup was encrypted to, lower-case hex, sorted. A restore requires the sidecar's recipients, and the ones it is configured with, to give the same list. Absent on a failure.",
      "x-audit-class": "shared",
      "x-audit-pii": "none",
      "items": {
        "type": "string",
        "x-audit-class": "shared",
        "x-audit-pii": "none"
      }
    },
    "reason": {
      "type": "string",
      "description": "A short word for why a run failed (export, archive, key, maintenance, canceled); absent on success.",
      "x-audit-class": "shared",
      "x-audit-pii": "none"
    }
  }
}
