{
  "$id": "https://schemas.example/access-roster/v1/client-secret.json",
  "type": "object",
  "additionalProperties": false,
  "properties": {
    "action": {
      "type": "string",
      "description": "What a refused request asked for: rotate, show or purge.",
      "x-audit-class": "shared",
      "x-audit-pii": "none",
      "x-audit-facet": true
    },
    "reason": {
      "type": "string",
      "description": "Why it was refused: forbidden, wrong_audience, busy, not_generated, still_declared, no_record or bad_overlap.",
      "x-audit-class": "shared",
      "x-audit-pii": "none",
      "x-audit-facet": true
    },
    "source": {
      "type": "string",
      "description": "Where an adopted secret came from: the input secret the installation delivers, or a stored record that had been reported orphaned and came back.",
      "x-audit-class": "shared",
      "x-audit-pii": "none"
    },
    "created": {
      "type": "string",
      "description": "When the stored secret was made (RFC 3339).",
      "x-audit-class": "shared",
      "x-audit-pii": "none"
    },
    "rotated": {
      "type": "string",
      "description": "When the secret was replaced (RFC 3339).",
      "x-audit-class": "shared",
      "x-audit-pii": "none"
    },
    "overlap_seconds": {
      "type": "integer",
      "description": "How long the replaced secret stays accepted; 0 is a hard cut.",
      "x-audit-class": "shared",
      "x-audit-pii": "none"
    },
    "previous_valid_until": {
      "type": "string",
      "description": "When the replaced secret stops being accepted (RFC 3339); absent after a hard cut.",
      "x-audit-class": "shared",
      "x-audit-pii": "none"
    },
    "discarded_previous": {
      "type": "boolean",
      "description": "The rotation was made while an earlier overlap was still open, so that older secret stopped being accepted.",
      "x-audit-class": "shared",
      "x-audit-pii": "none"
    },
    "orphaned": {
      "type": "string",
      "description": "When the stored secret was first found without a generated client in the policy (RFC 3339).",
      "x-audit-class": "shared",
      "x-audit-pii": "none"
    }
  }
}
