{
  "$id": "https://schemas.example/access-roster/v1/secrets-rekeyed.json",
  "type": "object",
  "additionalProperties": false,
  "properties": {
    "installation": {
      "type": "string",
      "description": "The installation whose parameters are re-written.",
      "x-audit-class": "shared",
      "x-audit-pii": "none"
    },
    "key": {
      "type": "string",
      "description": "The key the parameters are re-written under, as the document names it (an alias).",
      "x-audit-class": "shared",
      "x-audit-pii": "none"
    },
    "phase": {
      "type": "string",
      "description": "started: kept before the first write; completed: kept after the last one.",
      "x-audit-class": "shared",
      "x-audit-pii": "none"
    },
    "considered": {
      "type": "integer",
      "description": "How many SecureString parameters the root holds.",
      "x-audit-class": "shared",
      "x-audit-pii": "none"
    },
    "planned": {
      "type": "integer",
      "description": "How many of them the run re-writes.",
      "x-audit-class": "shared",
      "x-audit-pii": "none"
    },
    "rekeyed": {
      "type": "integer",
      "description": "How many were re-written so far (completed) or none (started).",
      "x-audit-class": "shared",
      "x-audit-pii": "none"
    },
    "deferred": {
      "type": "integer",
      "description": "How many were left because they changed within secrets.grace.",
      "x-audit-class": "shared",
      "x-audit-pii": "none"
    },
    "names": {
      "type": "array",
      "description": "The names of the parameters to re-write. Names only, never a value.",
      "x-audit-class": "shared",
      "x-audit-pii": "none",
      "items": {
        "type": "string",
        "x-audit-class": "shared",
        "x-audit-pii": "none"
      }
    }
  }
}
